{
  "protocol_version": "0.1",
  "world": {
    "name": "awp-sim",
    "version": "0.1.0a4",
    "vendor": "hyperduality"
  },
  "time_models": [
    "streaming"
  ],
  "capabilities": {},
  "initial_states": [
    "home"
  ],
  "embodiments": [
    {
      "id": "arm_01",
      "kind": "manipulator",
      "action_types": [
        "move_to_pose",
        "stop"
      ],
      "channels": [
        "proprio",
        "arm_state"
      ]
    }
  ],
  "observation_channels": [
    {
      "id": "proprio",
      "modality": "proprio/json",
      "rate_hz": 100.0,
      "loss_class": "latest-wins",
      "stale_after_ms": 50,
      "schema": {
        "fields": [
          "p_m",
          "v_mps"
        ],
        "frame": "base"
      }
    },
    {
      "id": "arm_state",
      "modality": "text/event+json",
      "rate_hz": 10.0,
      "loss_class": "reliable",
      "schema": {
        "type": "object",
        "properties": {
          "phase": {
            "enum": [
              "idle",
              "moving",
              "stopping",
              "servo"
            ]
          },
          "target_m": {
            "type": [
              "array",
              "null"
            ]
          },
          "action_id": {
            "type": [
              "string",
              "null"
            ]
          }
        },
        "required": [
          "phase",
          "target_m",
          "action_id"
        ]
      }
    }
  ],
  "action_schemas": [
    {
      "type": "move_to_pose",
      "params_schema": {
        "$ref": "#/$defs/move_to_pose_params"
      },
      "duration": "extended",
      "preemption": [
        "replace",
        "queue",
        "reject"
      ],
      "concurrency_group": "arm_motion",
      "max_queue": 4,
      "max_abort_ms": 1500,
      "max_duration_ms": 10000,
      "description": "Move the end effector in a straight line to a position."
    },
    {
      "type": "stop",
      "params_schema": {
        "type": "object",
        "additionalProperties": false
      },
      "duration": "instant",
      "preemption": "replace",
      "concurrency_group": "arm_motion",
      "description": "Decelerate to rest; replaces any motion."
    }
  ],
  "safety_policy": {
    "envelopes": [
      {
        "embodiment": "arm_01",
        "spatial": {
          "frame": "base",
          "aabb_m": [
            [
              -0.5,
              -0.5,
              0.0
            ],
            [
              0.5,
              0.5,
              0.8
            ]
          ]
        },
        "max_velocity_mps": 0.5,
        "max_action_rate_hz": 20.0,
        "enforcement": "command_check",
        "on_violation": "reject"
      }
    ],
    "safe_state": {
      "behavior": "safe_stop",
      "watchdog_ms": 2000
    },
    "max_basis_age_ms": 500
  },
  "$defs": {
    "move_to_pose_params": {
      "type": "object",
      "properties": {
        "pose": {
          "$ref": "https://agentworldprotocol.com/schemas/v0.1/common.schema.json#/$defs/pose"
        },
        "max_velocity_mps": {
          "type": "number",
          "exclusiveMinimum": 0
        }
      },
      "required": [
        "pose"
      ],
      "additionalProperties": false
    }
  }
}
